{
  "schema_version": "source-sequence-manifest.v1",
  "manifest_id": "xhs:67fbb4a7000000001d021b3a:snapshot-95b77bb26104:note-desc-2:sequence-v1",
  "interview_note_id": "xhs:67fbb4a7000000001d021b3a",
  "source_revision_id": "xhs-note:67fbb4a7000000001d021b3a:snapshot-95b77bb26104",
  "sequence_scope": "source-projection:note_desc/67fbb4a7000000001d021b3a.txt:interview-flow-units-1-2",
  "evidence_stream": {
    "stream_id": "pinned-note-desc",
    "storage_kind": "git",
    "raw_artifact_ref": "liqiangcc/xhs:note_detail/67fbb4a7000000001d021b3a.html@95b77bb261048059846273688e4b90a2e108b437",
    "raw_git_blob_sha": "67457bd40837d0116a3cfa4ed9b3cdcf3c7aa931",
    "raw_sha256": "598c393cd8523247a1017193b90863fdd9c55b1762ca145042b6854b85f090b7",
    "readable_projection": {
      "ref": "liqiangcc/xhs:note_desc/67fbb4a7000000001d021b3a.txt@95b77bb261048059846273688e4b90a2e108b437",
      "storage_kind": "git",
      "git_blob_sha": "d5badf007e9ee4b06bc7d07fcf702c729a2ee062",
      "sha256": "5483d672e10ce30a416c11f712bf39d7761db10d041339773e5ebcbc9868a159",
      "provenance": "source_projection",
      "review_status": "unreviewed"
    }
  },
  "units": [
    {
      "source_unit_id": "xhs:67fbb4a7000000001d021b3a:snapshot-95b77bb26104:note-desc-2:u1",
      "position": 1,
      "source_unit_type": "question-like",
      "text_projection": "1.设计一个分布式任务调度框架，怎么保证任务不被重复执行？任务分发下去执行失败了怎么办？follower宕机了怎么办？master宕机了怎么办？怎么保证这个系统的一致性？为什么你需要两阶段提交？",
      "source_provenance": {
        "source_projection_ref": "liqiangcc/xhs:note_desc/67fbb4a7000000001d021b3a.txt@95b77bb261048059846273688e4b90a2e108b437",
        "source_projection_sha256": "5483d672e10ce30a416c11f712bf39d7761db10d041339773e5ebcbc9868a159",
        "raw_artifact_ref": "liqiangcc/xhs:note_detail/67fbb4a7000000001d021b3a.html@95b77bb261048059846273688e4b90a2e108b437",
        "raw_sha256": "598c393cd8523247a1017193b90863fdd9c55b1762ca145042b6854b85f090b7",
        "source_projection_item_number": 1
      },
      "fragments": []
    },
    {
      "source_unit_id": "xhs:67fbb4a7000000001d021b3a:snapshot-95b77bb26104:note-desc-2:u2",
      "position": 2,
      "source_unit_type": "question-like",
      "text_projection": "2. 设计一个唯一id生成器？就用MySQL做存储中间件，隔离级别是怎么样的？",
      "source_provenance": {
        "source_projection_ref": "liqiangcc/xhs:note_desc/67fbb4a7000000001d021b3a.txt@95b77bb261048059846273688e4b90a2e108b437",
        "source_projection_sha256": "5483d672e10ce30a416c11f712bf39d7761db10d041339773e5ebcbc9868a159",
        "raw_artifact_ref": "liqiangcc/xhs:note_detail/67fbb4a7000000001d021b3a.html@95b77bb261048059846273688e4b90a2e108b437",
        "raw_sha256": "598c393cd8523247a1017193b90863fdd9c55b1762ca145042b6854b85f090b7",
        "source_projection_item_number": 2
      },
      "fragments": []
    }
  ],
  "content_sha256": "b69f98535fd504a47b419e89b3305c21d2656828d667df5a1cc1ec2077c1bbdb"
}
