{
  "schema_version": "source-sequence-manifest.v1",
  "manifest_id": "xhs:6757f8340000000002036fb7:snapshot-95b77bb26104:note-desc-1:sequence-v1",
  "interview_note_id": "xhs:6757f8340000000002036fb7",
  "source_revision_id": "xhs-note:6757f8340000000002036fb7:snapshot-95b77bb26104",
  "sequence_scope": "source-projection:note_desc/6757f8340000000002036fb7.txt:interview-flow-units-1-1",
  "evidence_stream": {
    "stream_id": "pinned-note-desc",
    "storage_kind": "git",
    "raw_artifact_ref": "liqiangcc/xhs:note_detail/6757f8340000000002036fb7.html@95b77bb261048059846273688e4b90a2e108b437",
    "raw_git_blob_sha": "3787b4ce4b6e77eb031e2fcc1b73d842874544aa",
    "raw_sha256": "0e788fad5063c4e91b9ad64e6017f836d2637be023747560c191e4b74727f250",
    "readable_projection": {
      "ref": "liqiangcc/xhs:note_desc/6757f8340000000002036fb7.txt@95b77bb261048059846273688e4b90a2e108b437",
      "storage_kind": "git",
      "git_blob_sha": "011f8f7cab1e99ffc42677769e86edaa7312909c",
      "sha256": "3cf3e650f656de37791b81e79c1c88fd5acde30208ef49c4e5da5c3cd019c8ea",
      "provenance": "source_projection",
      "review_status": "unreviewed"
    }
  },
  "units": [
    {
      "source_unit_id": "xhs:6757f8340000000002036fb7:snapshot-95b77bb26104:note-desc-1:u1",
      "position": 1,
      "source_unit_type": "question-like",
      "text_projection": "一共35min\n最后就是随便聊了聊，职业规划，哪的人，怎么平衡时间，读不读博，为什么选大厂等等。\n反问了业务是做啥的\n﻿#阿里巴巴[话题]#﻿ ﻿#高德地图[话题]#﻿ ﻿#java[话题]#﻿ ﻿#实习[话题]#﻿ ﻿#面试[话题]#﻿",
      "source_provenance": {
        "source_projection_ref": "liqiangcc/xhs:note_desc/6757f8340000000002036fb7.txt@95b77bb261048059846273688e4b90a2e108b437",
        "source_projection_sha256": "3cf3e650f656de37791b81e79c1c88fd5acde30208ef49c4e5da5c3cd019c8ea",
        "raw_artifact_ref": "liqiangcc/xhs:note_detail/6757f8340000000002036fb7.html@95b77bb261048059846273688e4b90a2e108b437",
        "raw_sha256": "0e788fad5063c4e91b9ad64e6017f836d2637be023747560c191e4b74727f250",
        "source_projection_item_number": 1
      },
      "fragments": []
    }
  ],
  "content_sha256": "41d44f071f5bfa559c5bf0d227b25ecdaa470d19f6d36380fbb88ddfc2acd49a"
}
