{
  "schema_version": "source-sequence-manifest.v1",
  "manifest_id": "xhs:6724513b000000001a01dd85:snapshot-95b77bb26104:note-desc-5:event-2:sequence-v1",
  "interview_note_id": "xhs:6724513b000000001a01dd85:event:ff226d825ba7322a1aa0f047647f2452e663fc681698a205bf0e15d3032853ca",
  "source_revision_id": "xhs-note:6724513b000000001a01dd85:snapshot-95b77bb26104",
  "sequence_scope": "source-projection:note_desc/6724513b000000001a01dd85.txt:case-event-2:interview-flow-units-1-5",
  "evidence_stream": {
    "stream_id": "pinned-note-desc",
    "storage_kind": "git",
    "raw_artifact_ref": "liqiangcc/xhs:note_detail/6724513b000000001a01dd85.html@95b77bb261048059846273688e4b90a2e108b437",
    "raw_git_blob_sha": "fb3a95bb464e2ce95e472e70aeab35d87b2e42c1",
    "raw_sha256": "b074472f83b5b39395d1e28a90dedffbfbd6d8364cad59cbc029ae6b2826035b",
    "readable_projection": {
      "ref": "liqiangcc/xhs:note_desc/6724513b000000001a01dd85.txt@95b77bb261048059846273688e4b90a2e108b437",
      "storage_kind": "git",
      "git_blob_sha": "b4384cb523d41b087e5d8b3302ce60f1b56acb6e",
      "sha256": "724242c4f57424b9509df31f740643941c85bda2f47b8209d2b7ec1c73ee6d5c",
      "provenance": "source_projection",
      "review_status": "unreviewed"
    }
  },
  "units": [
    {
      "source_unit_id": "xhs:6724513b000000001a01dd85:snapshot-95b77bb26104:note-desc-5:event-2:u1",
      "position": 1,
      "source_unit_type": "outcome-reflection-summary",
      "text_projection": "我现在的情况是美团oc了，百度昨天刚二面完现在在等二面结果，面的感觉还行但是也不一定过，也不准备面别的大厂了，所以想提前确定一手offer～",
      "source_provenance": {
        "source_projection_ref": "liqiangcc/xhs:note_desc/6724513b000000001a01dd85.txt@95b77bb261048059846273688e4b90a2e108b437",
        "source_projection_sha256": "724242c4f57424b9509df31f740643941c85bda2f47b8209d2b7ec1c73ee6d5c",
        "raw_artifact_ref": "liqiangcc/xhs:note_detail/6724513b000000001a01dd85.html@95b77bb261048059846273688e4b90a2e108b437",
        "raw_sha256": "b074472f83b5b39395d1e28a90dedffbfbd6d8364cad59cbc029ae6b2826035b",
        "source_projection_item_number": 1
      },
      "fragments": []
    },
    {
      "source_unit_id": "xhs:6724513b000000001a01dd85:snapshot-95b77bb26104:note-desc-5:event-2:u2",
      "position": 2,
      "source_unit_type": "question-like",
      "text_projection": "2.百度 大模型应用研发实习生（Java开发），今天刚结束二面感觉还可以，薪资200-300/d（感觉在270左右）房补1500，百度福利应该是比较多，工作强度可能比较高（未知），团队氛围未知（不过百度团队氛围一向不错）",
      "source_provenance": {
        "source_projection_ref": "liqiangcc/xhs:note_desc/6724513b000000001a01dd85.txt@95b77bb261048059846273688e4b90a2e108b437",
        "source_projection_sha256": "724242c4f57424b9509df31f740643941c85bda2f47b8209d2b7ec1c73ee6d5c",
        "raw_artifact_ref": "liqiangcc/xhs:note_detail/6724513b000000001a01dd85.html@95b77bb261048059846273688e4b90a2e108b437",
        "raw_sha256": "b074472f83b5b39395d1e28a90dedffbfbd6d8364cad59cbc029ae6b2826035b",
        "source_projection_item_number": 2
      },
      "fragments": []
    },
    {
      "source_unit_id": "xhs:6724513b000000001a01dd85:snapshot-95b77bb26104:note-desc-5:event-2:u3",
      "position": 3,
      "source_unit_type": "narrative-summary",
      "text_projection": "base都是北京，title基本上五五开",
      "source_provenance": {
        "source_projection_ref": "liqiangcc/xhs:note_desc/6724513b000000001a01dd85.txt@95b77bb261048059846273688e4b90a2e108b437",
        "source_projection_sha256": "724242c4f57424b9509df31f740643941c85bda2f47b8209d2b7ec1c73ee6d5c",
        "raw_artifact_ref": "liqiangcc/xhs:note_detail/6724513b000000001a01dd85.html@95b77bb261048059846273688e4b90a2e108b437",
        "raw_sha256": "b074472f83b5b39395d1e28a90dedffbfbd6d8364cad59cbc029ae6b2826035b",
        "source_projection_item_number": 3
      },
      "fragments": []
    },
    {
      "source_unit_id": "xhs:6724513b000000001a01dd85:snapshot-95b77bb26104:note-desc-5:event-2:u4",
      "position": 4,
      "source_unit_type": "outcome-reflection-summary",
      "text_projection": "不过感觉美团在上升期，第一份实习想找个轻松一点的，但是百度那边技术含量感觉是很高的，今天二面的主管是真的强，也是真不知道咋选了",
      "source_provenance": {
        "source_projection_ref": "liqiangcc/xhs:note_desc/6724513b000000001a01dd85.txt@95b77bb261048059846273688e4b90a2e108b437",
        "source_projection_sha256": "724242c4f57424b9509df31f740643941c85bda2f47b8209d2b7ec1c73ee6d5c",
        "raw_artifact_ref": "liqiangcc/xhs:note_detail/6724513b000000001a01dd85.html@95b77bb261048059846273688e4b90a2e108b437",
        "raw_sha256": "b074472f83b5b39395d1e28a90dedffbfbd6d8364cad59cbc029ae6b2826035b",
        "source_projection_item_number": 4
      },
      "fragments": []
    },
    {
      "source_unit_id": "xhs:6724513b000000001a01dd85:snapshot-95b77bb26104:note-desc-5:event-2:u5",
      "position": 5,
      "source_unit_type": "outcome-reflection-summary",
      "text_projection": "目前偏向于美团，虽然这个岗可能后端学的东西有限，但是我正好想趁这个时候把微服务学了，而且第一把大厂实习想去体验一下生活～求佬们帮忙看看",
      "source_provenance": {
        "source_projection_ref": "liqiangcc/xhs:note_desc/6724513b000000001a01dd85.txt@95b77bb261048059846273688e4b90a2e108b437",
        "source_projection_sha256": "724242c4f57424b9509df31f740643941c85bda2f47b8209d2b7ec1c73ee6d5c",
        "raw_artifact_ref": "liqiangcc/xhs:note_detail/6724513b000000001a01dd85.html@95b77bb261048059846273688e4b90a2e108b437",
        "raw_sha256": "b074472f83b5b39395d1e28a90dedffbfbd6d8364cad59cbc029ae6b2826035b",
        "source_projection_item_number": 5
      },
      "fragments": []
    }
  ],
  "content_sha256": "5ac9e9df5d12a8818f547e56d9993f1492d26420e9c941c1e731e60de29884c1"
}
