{
  "schema_version": "source-sequence-manifest.v1",
  "manifest_id": "xhs:67da8789000000001d0230e6:snapshot-95b77bb26104:note-desc-4:sequence-v1",
  "interview_note_id": "xhs:67da8789000000001d0230e6",
  "source_revision_id": "xhs-note:67da8789000000001d0230e6:snapshot-95b77bb26104",
  "sequence_scope": "source-projection:note_desc/67da8789000000001d0230e6.txt:interview-flow-units-1-4",
  "evidence_stream": {
    "stream_id": "pinned-note-desc",
    "storage_kind": "git",
    "raw_artifact_ref": "liqiangcc/xhs:note_detail/67da8789000000001d0230e6.html@95b77bb261048059846273688e4b90a2e108b437",
    "raw_git_blob_sha": "034ba708a227601e8f8b4dfc2e75c3ca43246b05",
    "raw_sha256": "ea09d2f4607b0b60ef71561b3d784c444076b7cdbc39fdf7a97873fac5afaa0e",
    "readable_projection": {
      "ref": "liqiangcc/xhs:note_desc/67da8789000000001d0230e6.txt@95b77bb261048059846273688e4b90a2e108b437",
      "storage_kind": "git",
      "git_blob_sha": "b79d9bf73569812e049c4f2a27a4c0c7a4cf03dc",
      "sha256": "ac2d6987c0963fc90370b712f349e83ff7c93200f26460139f3cea436f3de2c2",
      "provenance": "source_projection",
      "review_status": "unreviewed"
    }
  },
  "units": [
    {
      "source_unit_id": "xhs:67da8789000000001d0230e6:snapshot-95b77bb26104:note-desc-4:u1",
      "position": 1,
      "source_unit_type": "question-like",
      "text_projection": "（图上生成错了）疑似kpi？\n面试官没开摄像头，上来先自我介绍\n介绍一下自己的项目经历\n然后问了项目里aop做公共字段填充 然后问一般aop不是干这个\n然后场景题：问aop设计一个不同用户对不同方法的权限控制怎么设计\n这个场景题里aop用前，后还是环绕\n然后问关系型数据库了解哪些\n谈谈怎么优化SQL查询\n谈谈怎么样去学新技术，让新技术落地的过程",
      "source_provenance": {
        "source_projection_ref": "liqiangcc/xhs:note_desc/67da8789000000001d0230e6.txt@95b77bb261048059846273688e4b90a2e108b437",
        "source_projection_sha256": "ac2d6987c0963fc90370b712f349e83ff7c93200f26460139f3cea436f3de2c2",
        "raw_artifact_ref": "liqiangcc/xhs:note_detail/67da8789000000001d0230e6.html@95b77bb261048059846273688e4b90a2e108b437",
        "raw_sha256": "ea09d2f4607b0b60ef71561b3d784c444076b7cdbc39fdf7a97873fac5afaa0e",
        "source_projection_item_number": 1
      },
      "fragments": []
    },
    {
      "source_unit_id": "xhs:67da8789000000001d0230e6:snapshot-95b77bb26104:note-desc-4:u2",
      "position": 2,
      "source_unit_type": "question-like",
      "text_projection": "到这差不多25分钟，然后问我有啥想知道的，问了想了解一下具体业务\n然后面试官和我介绍了差不多10分钟，主要是大数据，并发量不是很高，然后公司中日常可能会遇到的一些问题\n闲聊了一会儿",
      "source_provenance": {
        "source_projection_ref": "liqiangcc/xhs:note_desc/67da8789000000001d0230e6.txt@95b77bb261048059846273688e4b90a2e108b437",
        "source_projection_sha256": "ac2d6987c0963fc90370b712f349e83ff7c93200f26460139f3cea436f3de2c2",
        "raw_artifact_ref": "liqiangcc/xhs:note_detail/67da8789000000001d0230e6.html@95b77bb261048059846273688e4b90a2e108b437",
        "raw_sha256": "ea09d2f4607b0b60ef71561b3d784c444076b7cdbc39fdf7a97873fac5afaa0e",
        "source_projection_item_number": 2
      },
      "fragments": []
    },
    {
      "source_unit_id": "xhs:67da8789000000001d0230e6:snapshot-95b77bb26104:note-desc-4:u3",
      "position": 3,
      "source_unit_type": "question-like",
      "text_projection": "接着问我日常学习和工作用大模型用的多吗，现在人在北京吗",
      "source_provenance": {
        "source_projection_ref": "liqiangcc/xhs:note_desc/67da8789000000001d0230e6.txt@95b77bb261048059846273688e4b90a2e108b437",
        "source_projection_sha256": "ac2d6987c0963fc90370b712f349e83ff7c93200f26460139f3cea436f3de2c2",
        "raw_artifact_ref": "liqiangcc/xhs:note_detail/67da8789000000001d0230e6.html@95b77bb261048059846273688e4b90a2e108b437",
        "raw_sha256": "ea09d2f4607b0b60ef71561b3d784c444076b7cdbc39fdf7a97873fac5afaa0e",
        "source_projection_item_number": 3
      },
      "fragments": []
    },
    {
      "source_unit_id": "xhs:67da8789000000001d0230e6:snapshot-95b77bb26104:note-desc-4:u4",
      "position": 4,
      "source_unit_type": "outcome-reflection-summary",
      "text_projection": "最后没有算法代码考核\n这次面试感觉氛围非常轻松，基本上就是面试官和我一起探讨问题，也没有代码考核，有没有经验丰富的友友说说是不是kpi面，还是百度面试整体风格就这样\n[赞R] #后端开发[话题]# #面经[话题]# #java[话题]# #程序员[话题]# #前端后端开发[话题]# #找实习[话题]# #互联网大厂实习[话题]#",
      "source_provenance": {
        "source_projection_ref": "liqiangcc/xhs:note_desc/67da8789000000001d0230e6.txt@95b77bb261048059846273688e4b90a2e108b437",
        "source_projection_sha256": "ac2d6987c0963fc90370b712f349e83ff7c93200f26460139f3cea436f3de2c2",
        "raw_artifact_ref": "liqiangcc/xhs:note_detail/67da8789000000001d0230e6.html@95b77bb261048059846273688e4b90a2e108b437",
        "raw_sha256": "ea09d2f4607b0b60ef71561b3d784c444076b7cdbc39fdf7a97873fac5afaa0e",
        "source_projection_item_number": 4
      },
      "fragments": []
    }
  ],
  "content_sha256": "8c2e222b9b271134076723cffe4ce9c730ce639a6ac70b4738de39ff7505243b"
}
