{
  "schema_version": "source-sequence-manifest.v1",
  "manifest_id": "xhs:68230ab100000000210084ae:snapshot-95b77bb26104:note-desc-1:sequence-v1",
  "interview_note_id": "xhs:68230ab100000000210084ae",
  "source_revision_id": "xhs-note:68230ab100000000210084ae:snapshot-95b77bb26104",
  "sequence_scope": "source-projection:note_desc/68230ab100000000210084ae.txt:interview-flow-units-1-1",
  "evidence_stream": {
    "stream_id": "pinned-note-desc",
    "storage_kind": "git",
    "raw_artifact_ref": "liqiangcc/xhs:note_detail/68230ab100000000210084ae.html@95b77bb261048059846273688e4b90a2e108b437",
    "raw_git_blob_sha": "fd2d619155727f0a471e52de1fabc5e87a86fe9b",
    "raw_sha256": "ad8e629fd49b5088c302241e1822350e12d62a5fc9abc1eee2e471fb227d631a",
    "readable_projection": {
      "ref": "liqiangcc/xhs:note_desc/68230ab100000000210084ae.txt@95b77bb261048059846273688e4b90a2e108b437",
      "storage_kind": "git",
      "git_blob_sha": "65bde686bed5db723d8bc858c17d8af30dc498a4",
      "sha256": "2df21f36369ff86328d0df6a26b0d3d392c0a328c238617c49e14661b101001f",
      "provenance": "source_projection",
      "review_status": "unreviewed"
    }
  },
  "units": [
    {
      "source_unit_id": "xhs:68230ab100000000210084ae:snapshot-95b77bb26104:note-desc-1:u1",
      "position": 1,
      "source_unit_type": "outcome-reflection-summary",
      "text_projection": "面试官进来的猝不及防，我还沉浸在两分钟前没接到电话的遗憾当中[失望R][失望R]\n开始正常的问项目，具体项目里面的实现。\n没问八股，都是我讲着讲着引出了一些八股[笑哭R]\n然后问大模型用的怎么样，了解哪些[失望R]\n手撕也几分钟写出来了。\n感觉总体来说，淡淡的，面试官可能比较i[笑哭R]\n求团子收留[合十R][合十R][合十R]",
      "source_provenance": {
        "source_projection_ref": "liqiangcc/xhs:note_desc/68230ab100000000210084ae.txt@95b77bb261048059846273688e4b90a2e108b437",
        "source_projection_sha256": "2df21f36369ff86328d0df6a26b0d3d392c0a328c238617c49e14661b101001f",
        "raw_artifact_ref": "liqiangcc/xhs:note_detail/68230ab100000000210084ae.html@95b77bb261048059846273688e4b90a2e108b437",
        "raw_sha256": "ad8e629fd49b5088c302241e1822350e12d62a5fc9abc1eee2e471fb227d631a",
        "source_projection_item_number": 1
      },
      "fragments": []
    }
  ],
  "content_sha256": "839907cf1fbd84e71c434ac9449710fe48abca8f474a6dd7f1069f2bb39db12b"
}
