{
  "schema_version": "source-sequence-manifest.v1",
  "manifest_id": "xhs:68d4ea880000000013008932:snapshot-95b77bb26104:note-json-desc-11:sequence-v1",
  "interview_note_id": "xhs:68d4ea880000000013008932",
  "source_revision_id": "xhs-note:68d4ea880000000013008932:snapshot-95b77bb26104",
  "sequence_scope": "source-projection:note_json/68d4ea880000000013008932.json:interview-flow-units-1-11",
  "evidence_stream": {
    "stream_id": "pinned-note-json-desc",
    "storage_kind": "git",
    "raw_artifact_ref": "liqiangcc/xhs:note_detail/68d4ea880000000013008932.html@95b77bb261048059846273688e4b90a2e108b437",
    "raw_git_blob_sha": "9793c1a10f4690bc92d7aa92e3fbec504857b11c",
    "raw_sha256": "e79924abde6cf5b65e567257d0ab178100e26f0beebd7f5b23441d835eefe272",
    "readable_projection": {
      "ref": "liqiangcc/xhs:note_json/68d4ea880000000013008932.json@95b77bb261048059846273688e4b90a2e108b437",
      "storage_kind": "git",
      "git_blob_sha": "231c35bc6064c458dec620de74a80e018bb9dc52",
      "sha256": "6b1604e48645f0649229fe483517404891a75dc8eb3be6e3333eb2748a19ba18",
      "provenance": "source_projection",
      "review_status": "unreviewed"
    }
  },
  "units": [
    {
      "source_unit_id": "xhs:68d4ea880000000013008932:snapshot-95b77bb26104:note-json-desc-11:u1",
      "position": 1,
      "source_unit_type": "narrative-summary",
      "text_projection": "菜鸟 JAVA一面 社招",
      "source_provenance": {
        "source_projection_ref": "liqiangcc/xhs:note_json/68d4ea880000000013008932.json@95b77bb261048059846273688e4b90a2e108b437",
        "source_projection_sha256": "6b1604e48645f0649229fe483517404891a75dc8eb3be6e3333eb2748a19ba18",
        "raw_artifact_ref": "liqiangcc/xhs:note_detail/68d4ea880000000013008932.html@95b77bb261048059846273688e4b90a2e108b437",
        "raw_sha256": "e79924abde6cf5b65e567257d0ab178100e26f0beebd7f5b23441d835eefe272",
        "source_projection_item_number": 1
      },
      "fragments": []
    },
    {
      "source_unit_id": "xhs:68d4ea880000000013008932:snapshot-95b77bb26104:note-json-desc-11:u2",
      "position": 2,
      "source_unit_type": "question-like",
      "text_projection": "1、聊聊集合，ArrayList、LinkedList、HashMap",
      "source_provenance": {
        "source_projection_ref": "liqiangcc/xhs:note_json/68d4ea880000000013008932.json@95b77bb261048059846273688e4b90a2e108b437",
        "source_projection_sha256": "6b1604e48645f0649229fe483517404891a75dc8eb3be6e3333eb2748a19ba18",
        "raw_artifact_ref": "liqiangcc/xhs:note_detail/68d4ea880000000013008932.html@95b77bb261048059846273688e4b90a2e108b437",
        "raw_sha256": "e79924abde6cf5b65e567257d0ab178100e26f0beebd7f5b23441d835eefe272",
        "source_projection_item_number": 2
      },
      "fragments": []
    },
    {
      "source_unit_id": "xhs:68d4ea880000000013008932:snapshot-95b77bb26104:note-json-desc-11:u3",
      "position": 3,
      "source_unit_type": "question-like",
      "text_projection": "2、多线程，线程池、什么情况下会扩容、核心线程数量是怎么设定的",
      "source_provenance": {
        "source_projection_ref": "liqiangcc/xhs:note_json/68d4ea880000000013008932.json@95b77bb261048059846273688e4b90a2e108b437",
        "source_projection_sha256": "6b1604e48645f0649229fe483517404891a75dc8eb3be6e3333eb2748a19ba18",
        "raw_artifact_ref": "liqiangcc/xhs:note_detail/68d4ea880000000013008932.html@95b77bb261048059846273688e4b90a2e108b437",
        "raw_sha256": "e79924abde6cf5b65e567257d0ab178100e26f0beebd7f5b23441d835eefe272",
        "source_projection_item_number": 3
      },
      "fragments": []
    },
    {
      "source_unit_id": "xhs:68d4ea880000000013008932:snapshot-95b77bb26104:note-json-desc-11:u4",
      "position": 4,
      "source_unit_type": "question-like",
      "text_projection": "3、ConcurrentHashMap怎么保证线程安全，volatile可见性",
      "source_provenance": {
        "source_projection_ref": "liqiangcc/xhs:note_json/68d4ea880000000013008932.json@95b77bb261048059846273688e4b90a2e108b437",
        "source_projection_sha256": "6b1604e48645f0649229fe483517404891a75dc8eb3be6e3333eb2748a19ba18",
        "raw_artifact_ref": "liqiangcc/xhs:note_detail/68d4ea880000000013008932.html@95b77bb261048059846273688e4b90a2e108b437",
        "raw_sha256": "e79924abde6cf5b65e567257d0ab178100e26f0beebd7f5b23441d835eefe272",
        "source_projection_item_number": 4
      },
      "fragments": []
    },
    {
      "source_unit_id": "xhs:68d4ea880000000013008932:snapshot-95b77bb26104:note-json-desc-11:u5",
      "position": 5,
      "source_unit_type": "question-like",
      "text_projection": "4、Java中的锁，synchronized，Lock",
      "source_provenance": {
        "source_projection_ref": "liqiangcc/xhs:note_json/68d4ea880000000013008932.json@95b77bb261048059846273688e4b90a2e108b437",
        "source_projection_sha256": "6b1604e48645f0649229fe483517404891a75dc8eb3be6e3333eb2748a19ba18",
        "raw_artifact_ref": "liqiangcc/xhs:note_detail/68d4ea880000000013008932.html@95b77bb261048059846273688e4b90a2e108b437",
        "raw_sha256": "e79924abde6cf5b65e567257d0ab178100e26f0beebd7f5b23441d835eefe272",
        "source_projection_item_number": 5
      },
      "fragments": []
    },
    {
      "source_unit_id": "xhs:68d4ea880000000013008932:snapshot-95b77bb26104:note-json-desc-11:u6",
      "position": 6,
      "source_unit_type": "question-like",
      "text_projection": "5、Spring，IOC和AOP，AOP哪些场景有用到，bean的生命周期",
      "source_provenance": {
        "source_projection_ref": "liqiangcc/xhs:note_json/68d4ea880000000013008932.json@95b77bb261048059846273688e4b90a2e108b437",
        "source_projection_sha256": "6b1604e48645f0649229fe483517404891a75dc8eb3be6e3333eb2748a19ba18",
        "raw_artifact_ref": "liqiangcc/xhs:note_detail/68d4ea880000000013008932.html@95b77bb261048059846273688e4b90a2e108b437",
        "raw_sha256": "e79924abde6cf5b65e567257d0ab178100e26f0beebd7f5b23441d835eefe272",
        "source_projection_item_number": 6
      },
      "fragments": []
    },
    {
      "source_unit_id": "xhs:68d4ea880000000013008932:snapshot-95b77bb26104:note-json-desc-11:u7",
      "position": 7,
      "source_unit_type": "question-like",
      "text_projection": "6、Spring事务失效",
      "source_provenance": {
        "source_projection_ref": "liqiangcc/xhs:note_json/68d4ea880000000013008932.json@95b77bb261048059846273688e4b90a2e108b437",
        "source_projection_sha256": "6b1604e48645f0649229fe483517404891a75dc8eb3be6e3333eb2748a19ba18",
        "raw_artifact_ref": "liqiangcc/xhs:note_detail/68d4ea880000000013008932.html@95b77bb261048059846273688e4b90a2e108b437",
        "raw_sha256": "e79924abde6cf5b65e567257d0ab178100e26f0beebd7f5b23441d835eefe272",
        "source_projection_item_number": 7
      },
      "fragments": []
    },
    {
      "source_unit_id": "xhs:68d4ea880000000013008932:snapshot-95b77bb26104:note-json-desc-11:u8",
      "position": 8,
      "source_unit_type": "question-like",
      "text_projection": "7、项目中有没有遇到redis缓存穿透、缓存击穿的情况（没有）",
      "source_provenance": {
        "source_projection_ref": "liqiangcc/xhs:note_json/68d4ea880000000013008932.json@95b77bb261048059846273688e4b90a2e108b437",
        "source_projection_sha256": "6b1604e48645f0649229fe483517404891a75dc8eb3be6e3333eb2748a19ba18",
        "raw_artifact_ref": "liqiangcc/xhs:note_detail/68d4ea880000000013008932.html@95b77bb261048059846273688e4b90a2e108b437",
        "raw_sha256": "e79924abde6cf5b65e567257d0ab178100e26f0beebd7f5b23441d835eefe272",
        "source_projection_item_number": 8
      },
      "fragments": []
    },
    {
      "source_unit_id": "xhs:68d4ea880000000013008932:snapshot-95b77bb26104:note-json-desc-11:u9",
      "position": 9,
      "source_unit_type": "question-like",
      "text_projection": "8、项目中遇到问题是怎么解决的，有没有遇到哪些困难",
      "source_provenance": {
        "source_projection_ref": "liqiangcc/xhs:note_json/68d4ea880000000013008932.json@95b77bb261048059846273688e4b90a2e108b437",
        "source_projection_sha256": "6b1604e48645f0649229fe483517404891a75dc8eb3be6e3333eb2748a19ba18",
        "raw_artifact_ref": "liqiangcc/xhs:note_detail/68d4ea880000000013008932.html@95b77bb261048059846273688e4b90a2e108b437",
        "raw_sha256": "e79924abde6cf5b65e567257d0ab178100e26f0beebd7f5b23441d835eefe272",
        "source_projection_item_number": 9
      },
      "fragments": []
    },
    {
      "source_unit_id": "xhs:68d4ea880000000013008932:snapshot-95b77bb26104:note-json-desc-11:u10",
      "position": 10,
      "source_unit_type": "question-like",
      "text_projection": "9、反问",
      "source_provenance": {
        "source_projection_ref": "liqiangcc/xhs:note_json/68d4ea880000000013008932.json@95b77bb261048059846273688e4b90a2e108b437",
        "source_projection_sha256": "6b1604e48645f0649229fe483517404891a75dc8eb3be6e3333eb2748a19ba18",
        "raw_artifact_ref": "liqiangcc/xhs:note_detail/68d4ea880000000013008932.html@95b77bb261048059846273688e4b90a2e108b437",
        "raw_sha256": "e79924abde6cf5b65e567257d0ab178100e26f0beebd7f5b23441d835eefe272",
        "source_projection_item_number": 10
      },
      "fragments": []
    },
    {
      "source_unit_id": "xhs:68d4ea880000000013008932:snapshot-95b77bb26104:note-json-desc-11:u11",
      "position": 11,
      "source_unit_type": "narrative-summary",
      "text_projection": "全程45-50min左右\n好像大概是这些，顺序可能有点乱，很多问题往深挖一点就不会了。\n面试官超好，给了我很多建议",
      "source_provenance": {
        "source_projection_ref": "liqiangcc/xhs:note_json/68d4ea880000000013008932.json@95b77bb261048059846273688e4b90a2e108b437",
        "source_projection_sha256": "6b1604e48645f0649229fe483517404891a75dc8eb3be6e3333eb2748a19ba18",
        "raw_artifact_ref": "liqiangcc/xhs:note_detail/68d4ea880000000013008932.html@95b77bb261048059846273688e4b90a2e108b437",
        "raw_sha256": "e79924abde6cf5b65e567257d0ab178100e26f0beebd7f5b23441d835eefe272",
        "source_projection_item_number": 11
      },
      "fragments": []
    }
  ],
  "content_sha256": "8dc3e293f07987f49d084cd41ab501efad55a89764f2788786c7d332f7f6c0a0"
}
