{
  "schema_version": "source-sequence-manifest.v1",
  "manifest_id": "xhs:683e6831000000002202530e:snapshot-95b77bb26104:note-desc-1:sequence-v1",
  "interview_note_id": "xhs:683e6831000000002202530e",
  "source_revision_id": "xhs-note:683e6831000000002202530e:snapshot-95b77bb26104",
  "sequence_scope": "source-projection:note_desc/683e6831000000002202530e.txt:interview-flow-units-1-1",
  "evidence_stream": {
    "stream_id": "pinned-note-desc",
    "storage_kind": "git",
    "raw_artifact_ref": "liqiangcc/xhs:note_detail/683e6831000000002202530e.html@95b77bb261048059846273688e4b90a2e108b437",
    "raw_git_blob_sha": "996800548760c3038140a83abf85dc761ae2f3db",
    "raw_sha256": "3e70300b5fb4215515fdd8fe626c87a7eb7156e4a46866eccd3680e7ddbced7e",
    "readable_projection": {
      "ref": "liqiangcc/xhs:note_desc/683e6831000000002202530e.txt@95b77bb261048059846273688e4b90a2e108b437",
      "storage_kind": "git",
      "git_blob_sha": "ef5460df5832215b5669381abbdc8b4607d6c301",
      "sha256": "7f927f063cb3527cb8838f6bf4e97bcf76c6bbb134008175b6434d5afd2e96be",
      "provenance": "source_projection",
      "review_status": "unreviewed"
    }
  },
  "units": [
    {
      "source_unit_id": "xhs:683e6831000000002202530e:snapshot-95b77bb26104:note-desc-1:u1",
      "position": 1,
      "source_unit_type": "outcome-reflection-summary",
      "text_projection": "节前面的，非常怪的三面，上来先做自我介绍，然后问我硕士学了哪些课程，哪些你觉得很有用的， 你假装我是选课的新生，给我推销一下这门课，让我引起兴趣（这？？？）\n然后是一个智力题，我不会[微笑R]，无手撕，然后就结束了\n今早收到感谢信",
      "source_provenance": {
        "source_projection_ref": "liqiangcc/xhs:note_desc/683e6831000000002202530e.txt@95b77bb261048059846273688e4b90a2e108b437",
        "source_projection_sha256": "7f927f063cb3527cb8838f6bf4e97bcf76c6bbb134008175b6434d5afd2e96be",
        "raw_artifact_ref": "liqiangcc/xhs:note_detail/683e6831000000002202530e.html@95b77bb261048059846273688e4b90a2e108b437",
        "raw_sha256": "3e70300b5fb4215515fdd8fe626c87a7eb7156e4a46866eccd3680e7ddbced7e",
        "source_projection_item_number": 1
      },
      "fragments": []
    }
  ],
  "content_sha256": "b29f2a13ae7451b9852a90e82111fd4813d097713199f3d952be611da0856a6b"
}
