{
  "schema_version": "source-sequence-manifest.v1",
  "manifest_id": "xhs:68b939f0000000001d029aba:snapshot-95b77bb26104:note-desc-3:sequence-v1",
  "interview_note_id": "xhs:68b939f0000000001d029aba",
  "source_revision_id": "xhs-note:68b939f0000000001d029aba:snapshot-95b77bb26104",
  "sequence_scope": "source-projection:note_desc/68b939f0000000001d029aba.txt:interview-flow-units-1-3",
  "evidence_stream": {
    "stream_id": "pinned-note-desc",
    "storage_kind": "git",
    "raw_artifact_ref": "liqiangcc/xhs:note_detail/68b939f0000000001d029aba.html@95b77bb261048059846273688e4b90a2e108b437",
    "raw_git_blob_sha": "8023912897d0a07821281787eb5a16c42564cfc4",
    "raw_sha256": "9d9e7c2b606236d46dfff789587fff8a3e1d856154661aaa7489dd9f0e1046eb",
    "readable_projection": {
      "ref": "liqiangcc/xhs:note_desc/68b939f0000000001d029aba.txt@95b77bb261048059846273688e4b90a2e108b437",
      "storage_kind": "git",
      "git_blob_sha": "78ba412a0aff7ebb01c7b9773e819a0e136f564f",
      "sha256": "6dae4ca54b6e22c0a85155864ce63ef9cbc46d13f8bfe2dcfb1faea38bf757d8",
      "provenance": "source_projection",
      "review_status": "unreviewed"
    }
  },
  "units": [
    {
      "source_unit_id": "xhs:68b939f0000000001d029aba:snapshot-95b77bb26104:note-desc-3:u1",
      "position": 1,
      "source_unit_type": "narrative-summary",
      "text_projection": "面试官没开摄像头，声音比较甜的小姐姐(难得[萌萌哒R])，45min",
      "source_provenance": {
        "source_projection_ref": "liqiangcc/xhs:note_desc/68b939f0000000001d029aba.txt@95b77bb261048059846273688e4b90a2e108b437",
        "source_projection_sha256": "6dae4ca54b6e22c0a85155864ce63ef9cbc46d13f8bfe2dcfb1faea38bf757d8",
        "raw_artifact_ref": "liqiangcc/xhs:note_detail/68b939f0000000001d029aba.html@95b77bb261048059846273688e4b90a2e108b437",
        "raw_sha256": "9d9e7c2b606236d46dfff789587fff8a3e1d856154661aaa7489dd9f0e1046eb",
        "source_projection_item_number": 1
      },
      "fragments": []
    },
    {
      "source_unit_id": "xhs:68b939f0000000001d029aba:snapshot-95b77bb26104:note-desc-3:u2",
      "position": 2,
      "source_unit_type": "question-like",
      "text_projection": "上来不用自我介绍，直接让挑最有挑战的问题讲\n问熟悉啥问啥[捂脸R]\nredis底层数据结构 跳表，与其他区别\nredis单线程模型\nmysql数据库 联合索引\n手撕: 要用kmp优化，不过忘了，讲时间复杂度\n反问:base北京，上海少，后端用的是go，业务是百度地图，几面",
      "source_provenance": {
        "source_projection_ref": "liqiangcc/xhs:note_desc/68b939f0000000001d029aba.txt@95b77bb261048059846273688e4b90a2e108b437",
        "source_projection_sha256": "6dae4ca54b6e22c0a85155864ce63ef9cbc46d13f8bfe2dcfb1faea38bf757d8",
        "raw_artifact_ref": "liqiangcc/xhs:note_detail/68b939f0000000001d029aba.html@95b77bb261048059846273688e4b90a2e108b437",
        "raw_sha256": "9d9e7c2b606236d46dfff789587fff8a3e1d856154661aaa7489dd9f0e1046eb",
        "source_projection_item_number": 2
      },
      "fragments": []
    },
    {
      "source_unit_id": "xhs:68b939f0000000001d029aba:snapshot-95b77bb26104:note-desc-3:u3",
      "position": 3,
      "source_unit_type": "narrative-summary",
      "text_projection": "八股乱答，铁g[失望R]",
      "source_provenance": {
        "source_projection_ref": "liqiangcc/xhs:note_desc/68b939f0000000001d029aba.txt@95b77bb261048059846273688e4b90a2e108b437",
        "source_projection_sha256": "6dae4ca54b6e22c0a85155864ce63ef9cbc46d13f8bfe2dcfb1faea38bf757d8",
        "raw_artifact_ref": "liqiangcc/xhs:note_detail/68b939f0000000001d029aba.html@95b77bb261048059846273688e4b90a2e108b437",
        "raw_sha256": "9d9e7c2b606236d46dfff789587fff8a3e1d856154661aaa7489dd9f0e1046eb",
        "source_projection_item_number": 3
      },
      "fragments": []
    }
  ],
  "content_sha256": "53de917fd12f3991e5f9cdc7089e479c47b594a00a3e441d45dde987352112e5"
}
