{
  "schema_version": "source-sequence-manifest.v1",
  "manifest_id": "xhs:67aef7c100000000170382ee:snapshot-95b77bb26104:note-desc-1:sequence-v1",
  "interview_note_id": "xhs:67aef7c100000000170382ee",
  "source_revision_id": "xhs-note:67aef7c100000000170382ee:snapshot-95b77bb26104",
  "sequence_scope": "source-projection:note_desc/67aef7c100000000170382ee.txt:interview-flow-units-1-1",
  "evidence_stream": {
    "stream_id": "pinned-note-desc",
    "storage_kind": "git",
    "raw_artifact_ref": "liqiangcc/xhs:note_detail/67aef7c100000000170382ee.html@95b77bb261048059846273688e4b90a2e108b437",
    "raw_git_blob_sha": "202808ae24a031806384fee2f9b22d49da6c59a8",
    "raw_sha256": "ffa4c8896ecf42b30e6710dc3d5fd1830ea0fc937b3f2768598a9d2dd63350ad",
    "readable_projection": {
      "ref": "liqiangcc/xhs:note_desc/67aef7c100000000170382ee.txt@95b77bb261048059846273688e4b90a2e108b437",
      "storage_kind": "git",
      "git_blob_sha": "99982a77d76d438a04261a0d5ca8a764f0e5b66e",
      "sha256": "f18c87bef1a0534da4a64665237e109c2594ca940dbc8aad49dc7a40a20888de",
      "provenance": "source_projection",
      "review_status": "unreviewed"
    }
  },
  "units": [
    {
      "source_unit_id": "xhs:67aef7c100000000170382ee:snapshot-95b77bb26104:note-desc-1:u1",
      "position": 1,
      "source_unit_type": "outcome-reflection-summary",
      "text_projection": "最终结果：二面挂（一面算法未AC）\n背景：面试官直接共享桌面，力扣抽题要求现场写未做过的题😱\n📝 二面问题回顾\n1️⃣ 垃圾回收算法\n● 问题：优缺点、使用场景（如标记清除、复制算法、分代回收）\n● 考察点：底层原理理解 + 实际应用思考（比如CMS和G1的差异）。\n2️⃣ Spring框架\n● 问题：核心特性（IOC/AOP）、设计模式（如动态代理）\n● 考察点：框架底层逻辑 + 扩展能力（比如Bean生命周期）。\n3️⃣ Java锁机制\n● 问题：synchronized vs ReentrantLock、CAS、锁升级过程\n● 考察点：并发编程基本功 + 源码级理解（如AQS原理）。\n4️⃣ MySQL锁机制\n● 问题：行锁、间隙锁、意向锁，结合实际场景说明（如高并发下单）\n● 考察点：事务隔离级别 + 锁的实战应用能力。\n5️⃣ 算法题\n● 题目：堆排序实现从大到小（要求独立补全完整代码）\n● 雷点：面试官只给main函数，需自实现堆结构！\n💥 挂科原因分析\n● 一面致命伤：回溯题思路正确但未去重，算法未AC直接导致淘汰。\n● 反思：即使八股答得不错，大厂仍会因算法不完美挂人！\n📌 血泪建议\n1️⃣ 算法优先级MAX！\n● 刷题时注意边界条件和去重逻辑，推荐按标签（回溯、动态规划）专项突破。\n● 练习白板coding，避免依赖IDE提示！\n2️⃣ 八股要“活学”\n● 锁机制、MySQL等高频考点，需结合场景（如“秒杀如何选锁？”）回答。\n● 推荐用XMind整理知识树，横向对比（如Java锁 vs MySQL锁）。\n3️⃣ 心态稳住！\n● 遇到陌生题先沟通思路，写注释体现思维过程，避免冷场❄️\n总结：大厂面试=50%算法+30%场景八股+20%缘分，继续肝题吧家人们！🔥\n需要补充细节可以留言哦～关注我，后续还有小红书、百度、腾讯的面经，祝下次上岸！🚀",
      "source_provenance": {
        "source_projection_ref": "liqiangcc/xhs:note_desc/67aef7c100000000170382ee.txt@95b77bb261048059846273688e4b90a2e108b437",
        "source_projection_sha256": "f18c87bef1a0534da4a64665237e109c2594ca940dbc8aad49dc7a40a20888de",
        "raw_artifact_ref": "liqiangcc/xhs:note_detail/67aef7c100000000170382ee.html@95b77bb261048059846273688e4b90a2e108b437",
        "raw_sha256": "ffa4c8896ecf42b30e6710dc3d5fd1830ea0fc937b3f2768598a9d2dd63350ad",
        "source_projection_item_number": 1
      },
      "fragments": []
    }
  ],
  "content_sha256": "4661effcaf6b656ee299a3a3dc9ff529de931c6fcfac0c9fff1fe0aefa9f6605"
}
