{
  "schema_version": "source-sequence-manifest.v1",
  "manifest_id": "xhs:67debbb300000000070369a8:snapshot-95b77bb26104:note-desc-1:sequence-v1",
  "interview_note_id": "xhs:67debbb300000000070369a8",
  "source_revision_id": "xhs-note:67debbb300000000070369a8:snapshot-95b77bb26104",
  "sequence_scope": "source-projection:note_desc/67debbb300000000070369a8.txt:interview-flow-units-1-1",
  "evidence_stream": {
    "stream_id": "pinned-note-desc",
    "storage_kind": "git",
    "raw_artifact_ref": "liqiangcc/xhs:note_detail/67debbb300000000070369a8.html@95b77bb261048059846273688e4b90a2e108b437",
    "raw_git_blob_sha": "6a203e9512ecea3ac34a192e10711857851d972e",
    "raw_sha256": "8fbff63426c6aec100208ab565f3436cb835dd99838dda684c2dbb3de0b806a3",
    "readable_projection": {
      "ref": "liqiangcc/xhs:note_desc/67debbb300000000070369a8.txt@95b77bb261048059846273688e4b90a2e108b437",
      "storage_kind": "git",
      "git_blob_sha": "919ff2ebfba5cef62e949478e8f4364d58e66efc",
      "sha256": "85759d7e8151ebc7aae037446fcc01cc4cc2be30c1271b59443a1521aae42c9e",
      "provenance": "source_projection",
      "review_status": "unreviewed"
    }
  },
  "units": [
    {
      "source_unit_id": "xhs:67debbb300000000070369a8:snapshot-95b77bb26104:note-desc-1:u1",
      "position": 1,
      "source_unit_type": "outcome-reflection-summary",
      "text_projection": "阿里系经典第一面喜欢电话先面，会提前打电话沟通时间。只有项目和个别八股，没有手撕。面完跟我说保持电话畅通，还期待了了一下，结果期待来了感谢信[再见R]，估计是横向对比挂了吧……",
      "source_provenance": {
        "source_projection_ref": "liqiangcc/xhs:note_desc/67debbb300000000070369a8.txt@95b77bb261048059846273688e4b90a2e108b437",
        "source_projection_sha256": "85759d7e8151ebc7aae037446fcc01cc4cc2be30c1271b59443a1521aae42c9e",
        "raw_artifact_ref": "liqiangcc/xhs:note_detail/67debbb300000000070369a8.html@95b77bb261048059846273688e4b90a2e108b437",
        "raw_sha256": "8fbff63426c6aec100208ab565f3436cb835dd99838dda684c2dbb3de0b806a3",
        "source_projection_item_number": 1
      },
      "fragments": []
    }
  ],
  "content_sha256": "b8f1726b3502ad1efac57b541b154d88cee4d2ca005b1050b63c5613fcdc90ff"
}
