{
  "schema_version": "source-sequence-manifest.v1",
  "manifest_id": "xhs:68da266d000000001101db29:snapshot-95b77bb26104:note-json-desc-4:sequence-v1",
  "interview_note_id": "xhs:68da266d000000001101db29",
  "source_revision_id": "xhs-note:68da266d000000001101db29:snapshot-95b77bb26104",
  "sequence_scope": "source-projection:note_json/68da266d000000001101db29.json:interview-flow-units-1-4",
  "evidence_stream": {
    "stream_id": "pinned-note-json-desc",
    "storage_kind": "git",
    "raw_artifact_ref": "liqiangcc/xhs:note_detail/68da266d000000001101db29.html@95b77bb261048059846273688e4b90a2e108b437",
    "raw_git_blob_sha": "7bbe9cba78bb26b1eca162fef03c1ba014369af7",
    "raw_sha256": "9a5ed934c500f661908597f66abe102a57cee0dfd15d14c1a18321b3aa2d6b29",
    "readable_projection": {
      "ref": "liqiangcc/xhs:note_json/68da266d000000001101db29.json@95b77bb261048059846273688e4b90a2e108b437",
      "storage_kind": "git",
      "git_blob_sha": "a1edb3e3293f5c4abe878b2840a03a16e1f10261",
      "sha256": "a09812431afbc75441fb668ca0707e2686b138d699d543cdcf84f37f0cabcc9d",
      "provenance": "source_projection",
      "review_status": "unreviewed"
    }
  },
  "units": [
    {
      "source_unit_id": "xhs:68da266d000000001101db29:snapshot-95b77bb26104:note-json-desc-4:u1",
      "position": 1,
      "source_unit_type": "outcome-reflection-summary",
      "text_projection": "除了实习之外问的都是比较基础的八股，面试时间半小时左右，2轮技术，一轮线下hr\n一面有手撕，二面无手撕，总结了三个有价值的问题其余都是实习和基础八股：",
      "source_provenance": {
        "source_projection_ref": "liqiangcc/xhs:note_json/68da266d000000001101db29.json@95b77bb261048059846273688e4b90a2e108b437",
        "source_projection_sha256": "a09812431afbc75441fb668ca0707e2686b138d699d543cdcf84f37f0cabcc9d",
        "raw_artifact_ref": "liqiangcc/xhs:note_detail/68da266d000000001101db29.html@95b77bb261048059846273688e4b90a2e108b437",
        "raw_sha256": "9a5ed934c500f661908597f66abe102a57cee0dfd15d14c1a18321b3aa2d6b29",
        "source_projection_item_number": 1
      },
      "fragments": []
    },
    {
      "source_unit_id": "xhs:68da266d000000001101db29:snapshot-95b77bb26104:note-json-desc-4:u2",
      "position": 2,
      "source_unit_type": "question-like",
      "text_projection": "1. rpc框架下，负载均衡是客户端做的还是注册中心做的",
      "source_provenance": {
        "source_projection_ref": "liqiangcc/xhs:note_json/68da266d000000001101db29.json@95b77bb261048059846273688e4b90a2e108b437",
        "source_projection_sha256": "a09812431afbc75441fb668ca0707e2686b138d699d543cdcf84f37f0cabcc9d",
        "raw_artifact_ref": "liqiangcc/xhs:note_detail/68da266d000000001101db29.html@95b77bb261048059846273688e4b90a2e108b437",
        "raw_sha256": "9a5ed934c500f661908597f66abe102a57cee0dfd15d14c1a18321b3aa2d6b29",
        "source_projection_item_number": 2
      },
      "fragments": []
    },
    {
      "source_unit_id": "xhs:68da266d000000001101db29:snapshot-95b77bb26104:note-json-desc-4:u3",
      "position": 3,
      "source_unit_type": "question-like",
      "text_projection": "2. rpc框架下，当服务端收到任务后，是一个个任务完成的还是哪种模式完成的",
      "source_provenance": {
        "source_projection_ref": "liqiangcc/xhs:note_json/68da266d000000001101db29.json@95b77bb261048059846273688e4b90a2e108b437",
        "source_projection_sha256": "a09812431afbc75441fb668ca0707e2686b138d699d543cdcf84f37f0cabcc9d",
        "raw_artifact_ref": "liqiangcc/xhs:note_detail/68da266d000000001101db29.html@95b77bb261048059846273688e4b90a2e108b437",
        "raw_sha256": "9a5ed934c500f661908597f66abe102a57cee0dfd15d14c1a18321b3aa2d6b29",
        "source_projection_item_number": 3
      },
      "fragments": []
    },
    {
      "source_unit_id": "xhs:68da266d000000001101db29:snapshot-95b77bb26104:note-json-desc-4:u4",
      "position": 4,
      "source_unit_type": "question-like",
      "text_projection": "3. 线程池死锁如果没有对应的日志该怎么排查？",
      "source_provenance": {
        "source_projection_ref": "liqiangcc/xhs:note_json/68da266d000000001101db29.json@95b77bb261048059846273688e4b90a2e108b437",
        "source_projection_sha256": "a09812431afbc75441fb668ca0707e2686b138d699d543cdcf84f37f0cabcc9d",
        "raw_artifact_ref": "liqiangcc/xhs:note_detail/68da266d000000001101db29.html@95b77bb261048059846273688e4b90a2e108b437",
        "raw_sha256": "9a5ed934c500f661908597f66abe102a57cee0dfd15d14c1a18321b3aa2d6b29",
        "source_projection_item_number": 4
      },
      "fragments": []
    }
  ],
  "content_sha256": "2d7cc1066197e22d98fd331c99883c51a69dab15057b232e077220c65485d138"
}
