{
  "schema_version": "source-sequence-manifest.v1",
  "manifest_id": "xhs:68aed790000000001b037ec1:snapshot-95b77bb26104:note-desc-1:sequence-v1",
  "interview_note_id": "xhs:68aed790000000001b037ec1",
  "source_revision_id": "xhs-note:68aed790000000001b037ec1:snapshot-95b77bb26104",
  "sequence_scope": "source-projection:note_desc/68aed790000000001b037ec1.txt:interview-flow-units-1-1",
  "evidence_stream": {
    "stream_id": "pinned-note-desc",
    "storage_kind": "git",
    "raw_artifact_ref": "liqiangcc/xhs:note_detail/68aed790000000001b037ec1.html@95b77bb261048059846273688e4b90a2e108b437",
    "raw_git_blob_sha": "9cabdca1449b9dc2c714a763cd81af6ecba2faed",
    "raw_sha256": "99799d83c2c079b9d4d8e1839526864cd8434a72d59b383d71e7f8b61780983c",
    "readable_projection": {
      "ref": "liqiangcc/xhs:note_desc/68aed790000000001b037ec1.txt@95b77bb261048059846273688e4b90a2e108b437",
      "storage_kind": "git",
      "git_blob_sha": "78e7f87e65fac3575e15b72fef657f15c47b4a50",
      "sha256": "1379aa73f2bb4163a0066e12ce611fad499811b99ca7914084a60fae4bda4b98",
      "provenance": "source_projection",
      "review_status": "unreviewed"
    }
  },
  "units": [
    {
      "source_unit_id": "xhs:68aed790000000001b037ec1:snapshot-95b77bb26104:note-desc-1:u1",
      "position": 1,
      "source_unit_type": "outcome-reflection-summary",
      "text_projection": "面试官看着挺年轻，会引导我的思路，感觉比较考察线上排查问题和解决问题的能力，还有实际的代码能力.\n反问为什么没有手撕[失望R]\n面试官最后一句：谢谢你的时间[失望R]",
      "source_provenance": {
        "source_projection_ref": "liqiangcc/xhs:note_desc/68aed790000000001b037ec1.txt@95b77bb261048059846273688e4b90a2e108b437",
        "source_projection_sha256": "1379aa73f2bb4163a0066e12ce611fad499811b99ca7914084a60fae4bda4b98",
        "raw_artifact_ref": "liqiangcc/xhs:note_detail/68aed790000000001b037ec1.html@95b77bb261048059846273688e4b90a2e108b437",
        "raw_sha256": "99799d83c2c079b9d4d8e1839526864cd8434a72d59b383d71e7f8b61780983c",
        "source_projection_item_number": 1
      },
      "fragments": []
    }
  ],
  "content_sha256": "7e51fcd91c31d84b44eeea7ced311a7f9461071b09244a7a022c0b9d9c676e4d"
}
