{
  "schema_version": "source-sequence-manifest.v1",
  "manifest_id": "xhs:6826e4210000000003039d41:snapshot-95b77bb26104:note-desc-7:sequence-v1",
  "interview_note_id": "xhs:6826e4210000000003039d41",
  "source_revision_id": "xhs-note:6826e4210000000003039d41:snapshot-95b77bb26104",
  "sequence_scope": "source-projection:note_desc/6826e4210000000003039d41.txt:interview-flow-units-1-7",
  "evidence_stream": {
    "stream_id": "pinned-note-desc",
    "storage_kind": "git",
    "raw_artifact_ref": "liqiangcc/xhs:note_detail/6826e4210000000003039d41.html@95b77bb261048059846273688e4b90a2e108b437",
    "raw_git_blob_sha": "a4484863cb49fd75ddcbc5dbf8d6aff989098cc0",
    "raw_sha256": "3511942eb3723677e840bcf2ff40b773156f107ae27b82642cde2c5fbefcbb60",
    "readable_projection": {
      "ref": "liqiangcc/xhs:note_desc/6826e4210000000003039d41.txt@95b77bb261048059846273688e4b90a2e108b437",
      "storage_kind": "git",
      "git_blob_sha": "f8e8936dfb691e3e88d9e607647b6816d3e42733",
      "sha256": "ac350face6fc357f50b83d249e20e22f38667116b01f0065df2106b874085ce6",
      "provenance": "source_projection",
      "review_status": "unreviewed"
    }
  },
  "units": [
    {
      "source_unit_id": "xhs:6826e4210000000003039d41:snapshot-95b77bb26104:note-desc-7:u1",
      "position": 1,
      "source_unit_type": "stage-summary",
      "text_projection": "快手社招 java 一二面",
      "source_provenance": {
        "source_projection_ref": "liqiangcc/xhs:note_desc/6826e4210000000003039d41.txt@95b77bb261048059846273688e4b90a2e108b437",
        "source_projection_sha256": "ac350face6fc357f50b83d249e20e22f38667116b01f0065df2106b874085ce6",
        "raw_artifact_ref": "liqiangcc/xhs:note_detail/6826e4210000000003039d41.html@95b77bb261048059846273688e4b90a2e108b437",
        "raw_sha256": "3511942eb3723677e840bcf2ff40b773156f107ae27b82642cde2c5fbefcbb60",
        "source_projection_item_number": 1
      },
      "fragments": []
    },
    {
      "source_unit_id": "xhs:6826e4210000000003039d41:snapshot-95b77bb26104:note-desc-7:u2",
      "position": 2,
      "source_unit_type": "narrative-summary",
      "text_projection": "📍面试公司：快手\n👜面试岗位： java 开发",
      "source_provenance": {
        "source_projection_ref": "liqiangcc/xhs:note_desc/6826e4210000000003039d41.txt@95b77bb261048059846273688e4b90a2e108b437",
        "source_projection_sha256": "ac350face6fc357f50b83d249e20e22f38667116b01f0065df2106b874085ce6",
        "raw_artifact_ref": "liqiangcc/xhs:note_detail/6826e4210000000003039d41.html@95b77bb261048059846273688e4b90a2e108b437",
        "raw_sha256": "3511942eb3723677e840bcf2ff40b773156f107ae27b82642cde2c5fbefcbb60",
        "source_projection_item_number": 2
      },
      "fragments": []
    },
    {
      "source_unit_id": "xhs:6826e4210000000003039d41:snapshot-95b77bb26104:note-desc-7:u3",
      "position": 3,
      "source_unit_type": "narrative-summary",
      "text_projection": "📖面试问题：",
      "source_provenance": {
        "source_projection_ref": "liqiangcc/xhs:note_desc/6826e4210000000003039d41.txt@95b77bb261048059846273688e4b90a2e108b437",
        "source_projection_sha256": "ac350face6fc357f50b83d249e20e22f38667116b01f0065df2106b874085ce6",
        "raw_artifact_ref": "liqiangcc/xhs:note_detail/6826e4210000000003039d41.html@95b77bb261048059846273688e4b90a2e108b437",
        "raw_sha256": "3511942eb3723677e840bcf2ff40b773156f107ae27b82642cde2c5fbefcbb60",
        "source_projection_item_number": 3
      },
      "fragments": []
    },
    {
      "source_unit_id": "xhs:6826e4210000000003039d41:snapshot-95b77bb26104:note-desc-7:u4",
      "position": 4,
      "source_unit_type": "stage-summary",
      "text_projection": "✅一面",
      "source_provenance": {
        "source_projection_ref": "liqiangcc/xhs:note_desc/6826e4210000000003039d41.txt@95b77bb261048059846273688e4b90a2e108b437",
        "source_projection_sha256": "ac350face6fc357f50b83d249e20e22f38667116b01f0065df2106b874085ce6",
        "raw_artifact_ref": "liqiangcc/xhs:note_detail/6826e4210000000003039d41.html@95b77bb261048059846273688e4b90a2e108b437",
        "raw_sha256": "3511942eb3723677e840bcf2ff40b773156f107ae27b82642cde2c5fbefcbb60",
        "source_projection_item_number": 4
      },
      "fragments": []
    },
    {
      "source_unit_id": "xhs:6826e4210000000003039d41:snapshot-95b77bb26104:note-desc-7:u5",
      "position": 5,
      "source_unit_type": "question-like",
      "text_projection": "1️⃣自我介绍+项目\n2️⃣分层缓存架构\n3️⃣数据如果只存在 redis 中可以吗\n4️⃣DB 中的写压力\n5️⃣MQ 有消息积压吗\n6️⃣DB 的 TPS\n7️⃣怎么分库分表的\n8️⃣读写分离\n9️⃣如果你们的redis中要新增一个数据，是怎么做的\n🔟怎么做的异步重试\n1️⃣1️⃣redis 中是什么形式来存的数据\n1️⃣2️⃣如果突然有很多数据要写进redis了，有什么措施\n1️⃣3️⃣如果缓存了 5 页数据，这个时候新增加了一条，会发生什么\n1️⃣4️⃣每台实例上的本地缓存都要存储所有的数据信息吗\n1️⃣5️⃣如果数据越来越多会对本地缓存造成什么影响\n1️⃣6️⃣本地缓存淘汰策略\n1️⃣7️⃣秒杀场景下单全流程\n1️⃣8️⃣库存回刷\n1️⃣9️⃣有一笔订单用户取消了，这个时候 redis 成功了但是数据库没成功，会发生什么\n2️⃣0️⃣如果你们在凌晨对账同步的时候刚好碰上用户下单呢\n2️⃣1️⃣被拦截的用户会看到什么报错\n2️⃣2️⃣具体加了什么锁\n2️⃣3️⃣分布式锁的原理是什么\n2️⃣4️⃣回删完成后怎么解锁\n2️⃣5️⃣锁的安全性怎么保证\n2️⃣6️⃣为什么你们释放锁的时候需要用一个唯一的 id 做校验\n2️⃣7️⃣threadLocal 怎么做到线程安全的\n2️⃣8️⃣threadLocalMap 和 HashMap 的区别\n2️⃣9️⃣ThreadLocal怎么避免内存泄漏\n3️⃣0️⃣AtomicInteger 类，这个类是线程安全的吗，原理是什么\n3️⃣1️⃣线程池调度机制\n3️⃣2️⃣Synchronized 和 reentrantlock的区别\n3️⃣3️⃣select * from t where a = 100 and b > 100 and b <= 1000 and c = 10，给这个 sql 创建索引\ninnodb 默认事务隔离级别\n3️⃣4️⃣可重复读和读已提交的区别\n✍🏻算法题：有序链表去除重复元素 给出1→2→3→3→4→4→5，返回1→2→5",
      "source_provenance": {
        "source_projection_ref": "liqiangcc/xhs:note_desc/6826e4210000000003039d41.txt@95b77bb261048059846273688e4b90a2e108b437",
        "source_projection_sha256": "ac350face6fc357f50b83d249e20e22f38667116b01f0065df2106b874085ce6",
        "raw_artifact_ref": "liqiangcc/xhs:note_detail/6826e4210000000003039d41.html@95b77bb261048059846273688e4b90a2e108b437",
        "raw_sha256": "3511942eb3723677e840bcf2ff40b773156f107ae27b82642cde2c5fbefcbb60",
        "source_projection_item_number": 5
      },
      "fragments": []
    },
    {
      "source_unit_id": "xhs:6826e4210000000003039d41:snapshot-95b77bb26104:note-desc-7:u6",
      "position": 6,
      "source_unit_type": "outcome-reflection-summary",
      "text_projection": "🙌面试体验：面试节奏很和谐",
      "source_provenance": {
        "source_projection_ref": "liqiangcc/xhs:note_desc/6826e4210000000003039d41.txt@95b77bb261048059846273688e4b90a2e108b437",
        "source_projection_sha256": "ac350face6fc357f50b83d249e20e22f38667116b01f0065df2106b874085ce6",
        "raw_artifact_ref": "liqiangcc/xhs:note_detail/6826e4210000000003039d41.html@95b77bb261048059846273688e4b90a2e108b437",
        "raw_sha256": "3511942eb3723677e840bcf2ff40b773156f107ae27b82642cde2c5fbefcbb60",
        "source_projection_item_number": 6
      },
      "fragments": []
    },
    {
      "source_unit_id": "xhs:6826e4210000000003039d41:snapshot-95b77bb26104:note-desc-7:u7",
      "position": 7,
      "source_unit_type": "narrative-summary",
      "text_projection": "因为篇幅限制\n二面与其他详情请看图片",
      "source_provenance": {
        "source_projection_ref": "liqiangcc/xhs:note_desc/6826e4210000000003039d41.txt@95b77bb261048059846273688e4b90a2e108b437",
        "source_projection_sha256": "ac350face6fc357f50b83d249e20e22f38667116b01f0065df2106b874085ce6",
        "raw_artifact_ref": "liqiangcc/xhs:note_detail/6826e4210000000003039d41.html@95b77bb261048059846273688e4b90a2e108b437",
        "raw_sha256": "3511942eb3723677e840bcf2ff40b773156f107ae27b82642cde2c5fbefcbb60",
        "source_projection_item_number": 7
      },
      "fragments": []
    }
  ],
  "content_sha256": "067572ddb6e78f02d032b789adb444d98189c93f27a9c90c48ec113a365b2af4"
}
